{
  "$schema": "https://json-schema.org/draft/2020-12/schema",
  "$id": "media.pdp0.aud-spec-002-source-amendment-postimage.v7",
  "type": "object",
  "additionalProperties": false,
  "required": [
    "schemaVersion",
    "artifactKind",
    "predecessorV6",
    "sourceBindings",
    "versionPopulation",
    "meaning",
    "applicability",
    "postimageSha256",
    "exactTargets",
    "preservation",
    "authorityBoundary"
  ],
  "properties": {
    "schemaVersion": {
      "const": "media.pdp0.aud-spec-002-source-amendment-postimage.v7"
    },
    "artifactKind": {
      "const": "NON_CANONICAL_SIX_SOURCE_POSTIMAGE_PROPOSAL"
    },
    "sourceBindings": {
      "type": "object",
      "additionalProperties": false,
      "required": [
        "rootDecisionSha256",
        "capabilitiesSha256",
        "requirementsSha256",
        "crosswalkSha256",
        "capabilityLeafReviewSha256",
        "campaignExtensionsSha256",
        "applicationsChannelsSha256",
        "auditSha256",
        "decisionLogSha256"
      ],
      "properties": {
        "rootDecisionSha256": {
          "type": "string",
          "pattern": "^[a-f0-9]{64}$"
        },
        "capabilitiesSha256": {
          "type": "string",
          "pattern": "^[a-f0-9]{64}$"
        },
        "requirementsSha256": {
          "type": "string",
          "pattern": "^[a-f0-9]{64}$"
        },
        "crosswalkSha256": {
          "type": "string",
          "pattern": "^[a-f0-9]{64}$"
        },
        "capabilityLeafReviewSha256": {
          "type": "string",
          "pattern": "^[a-f0-9]{64}$"
        },
        "campaignExtensionsSha256": {
          "type": "string",
          "pattern": "^[a-f0-9]{64}$"
        },
        "applicationsChannelsSha256": {
          "type": "string",
          "pattern": "^[a-f0-9]{64}$"
        },
        "auditSha256": {
          "type": "string",
          "pattern": "^[a-f0-9]{64}$"
        },
        "decisionLogSha256": {
          "type": "string",
          "pattern": "^[a-f0-9]{64}$"
        }
      }
    },
    "versionPopulation": {
      "type": "object",
      "additionalProperties": false,
      "required": [
        "historicalBaseCount",
        "currentExtensionCount",
        "futureProposalCount",
        "currentVersionCount",
        "totalExtensionCount",
        "totalSourceDefinitionCount",
        "currentExtensionIds",
        "futureProposalIds"
      ],
      "properties": {
        "historicalBaseCount": {
          "const": 462
        },
        "currentExtensionCount": {
          "const": 1
        },
        "futureProposalCount": {
          "const": 6
        },
        "currentVersionCount": {
          "const": 463
        },
        "totalExtensionCount": {
          "const": 7
        },
        "totalSourceDefinitionCount": {
          "const": 469
        },
        "currentExtensionIds": {
          "const": [
            "media.recipe.specification.compile"
          ]
        },
        "futureProposalIds": {
          "type": "array",
          "minItems": 6,
          "maxItems": 6,
          "uniqueItems": true,
          "items": {
            "type": "string",
            "minLength": 1
          }
        }
      }
    },
    "meaning": {
      "type": "object",
      "additionalProperties": false,
      "required": [
        "ordinaryCompileCase",
        "supportedMigrationCase",
        "unsupportedMigrationCase",
        "p1Boundary"
      ],
      "properties": {
        "ordinaryCompileCase": {
          "const": "MEDIA-REQ-CAP-RECIPE-TEMPLATE-AC-15"
        },
        "supportedMigrationCase": {
          "const": "MEDIA-REQ-CAP-RECIPE-TEMPLATE-AC-16"
        },
        "unsupportedMigrationCase": {
          "const": "MEDIA-REQ-CAP-RECIPE-TEMPLATE-AC-17"
        },
        "p1Boundary": {
          "const": "HISTORICAL_462_HANDOFF_RETAINED; no new P1 operation or runtime binding"
        }
      }
    },
    "applicability": {
      "type": "object",
      "additionalProperties": false,
      "required": [
        "channelSource",
        "channel",
        "surfaceIdentityCount",
        "phaseCellCount",
        "qualityDisposition",
        "qualityReviewRef",
        "futureProposalCount"
      ],
      "properties": {
        "channelSource": {
          "const": ".product-experience/pdp-0-product-truth/applications-channels.yaml#coordinatorDefinitionExtensionApplicability/records/@capabilityRef=media.recipe.specification.compile"
        },
        "channel": {
          "const": "media.channel.cli"
        },
        "surfaceIdentityCount": {
          "const": 54
        },
        "phaseCellCount": {
          "const": 216
        },
        "qualityDisposition": {
          "const": "UNKNOWN_PENDING_SEPARATE_SOURCE_BOUND_QUALITY_REVIEW"
        },
        "qualityReviewRef": {
          "const": "docs/implementation/verification/pdp-38/p0-quality-current-source-review-pxd225.json"
        },
        "futureProposalCount": {
          "const": 6
        }
      }
    },
    "postimageSha256": {
      "type": "object",
      "additionalProperties": false,
      "required": [
        "capabilitiesYaml",
        "requirementsYaml",
        "crosswalkJson",
        "capabilityLeafReviewYaml",
        "campaignExtensionsYaml",
        "decisionLogMarkdown"
      ],
      "properties": {
        "capabilitiesYaml": {
          "type": "string",
          "pattern": "^[a-f0-9]{64}$"
        },
        "requirementsYaml": {
          "type": "string",
          "pattern": "^[a-f0-9]{64}$"
        },
        "crosswalkJson": {
          "type": "string",
          "pattern": "^[a-f0-9]{64}$"
        },
        "capabilityLeafReviewYaml": {
          "type": "string",
          "pattern": "^[a-f0-9]{64}$"
        },
        "campaignExtensionsYaml": {
          "type": "string",
          "pattern": "^[a-f0-9]{64}$"
        },
        "decisionLogMarkdown": {
          "type": "string",
          "pattern": "^[a-f0-9]{64}$"
        }
      }
    },
    "exactTargets": {
      "type": "array",
      "minItems": 6,
      "maxItems": 6,
      "prefixItems": [
        {
          "type": "object",
          "additionalProperties": false,
          "required": [
            "targetRef",
            "preimageSha256",
            "postimageSha256"
          ],
          "properties": {
            "targetRef": {
              "const": ".product-experience/pdp-0-product-truth/capabilities.yaml"
            },
            "preimageSha256": {
              "type": "string",
              "pattern": "^[a-f0-9]{64}$"
            },
            "postimageSha256": {
              "type": "string",
              "pattern": "^[a-f0-9]{64}$"
            }
          }
        },
        {
          "type": "object",
          "additionalProperties": false,
          "required": [
            "targetRef",
            "preimageSha256",
            "postimageSha256"
          ],
          "properties": {
            "targetRef": {
              "const": ".product-experience/pdp-0-product-truth/requirements.yaml"
            },
            "preimageSha256": {
              "type": "string",
              "pattern": "^[a-f0-9]{64}$"
            },
            "postimageSha256": {
              "type": "string",
              "pattern": "^[a-f0-9]{64}$"
            }
          }
        },
        {
          "type": "object",
          "additionalProperties": false,
          "required": [
            "targetRef",
            "preimageSha256",
            "postimageSha256"
          ],
          "properties": {
            "targetRef": {
              "const": "docs/implementation/observations/pdp0-semantic-audit-slices/pdp0-501-disposition-crosswalk.json"
            },
            "preimageSha256": {
              "type": "string",
              "pattern": "^[a-f0-9]{64}$"
            },
            "postimageSha256": {
              "type": "string",
              "pattern": "^[a-f0-9]{64}$"
            }
          }
        },
        {
          "type": "object",
          "additionalProperties": false,
          "required": [
            "targetRef",
            "preimageSha256",
            "postimageSha256"
          ],
          "properties": {
            "targetRef": {
              "const": ".product-experience/pdp-0-product-truth/capability-leaf-review.yaml"
            },
            "preimageSha256": {
              "type": "string",
              "pattern": "^[a-f0-9]{64}$"
            },
            "postimageSha256": {
              "type": "string",
              "pattern": "^[a-f0-9]{64}$"
            }
          }
        },
        {
          "type": "object",
          "additionalProperties": false,
          "required": [
            "targetRef",
            "preimageSha256",
            "postimageSha256"
          ],
          "properties": {
            "targetRef": {
              "const": ".product-experience/pdp-0-product-truth/campaign-extensions.yaml"
            },
            "preimageSha256": {
              "type": "string",
              "pattern": "^[a-f0-9]{64}$"
            },
            "postimageSha256": {
              "type": "string",
              "pattern": "^[a-f0-9]{64}$"
            }
          }
        },
        {
          "type": "object",
          "additionalProperties": false,
          "required": [
            "targetRef",
            "preimageSha256",
            "postimageSha256"
          ],
          "properties": {
            "targetRef": {
              "const": ".product-experience/decision-log.md"
            },
            "preimageSha256": {
              "type": "string",
              "pattern": "^[a-f0-9]{64}$"
            },
            "postimageSha256": {
              "type": "string",
              "pattern": "^[a-f0-9]{64}$"
            }
          }
        }
      ],
      "items": false
    },
    "preservation": {
      "type": "object",
      "additionalProperties": false,
      "required": [
        "historicalOwnerRows",
        "historicalTrustRows",
        "currentExtensionRows",
        "futureExtensionIds",
        "surfaceIdentityCount",
        "phaseCellCount"
      ],
      "properties": {
        "historicalOwnerRows": {
          "const": "462_BYTE_PRESERVED_IN_ORDER"
        },
        "historicalTrustRows": {
          "const": "462_BYTE_PRESERVED_IN_ORDER"
        },
        "currentExtensionRows": {
          "const": "SEPARATE_TYPED_OWNER_AND_TRUST_RECORDS; ONE"
        },
        "futureExtensionIds": {
          "const": 6
        },
        "surfaceIdentityCount": {
          "const": 54
        },
        "phaseCellCount": {
          "const": 216
        }
      }
    },
    "authorityBoundary": {
      "type": "object",
      "additionalProperties": false,
      "required": [
        "sourceOwnerDecision",
        "technicalPeer",
        "canonicalApply",
        "phaseStatus",
        "sourceCurrentness",
        "qualityApplicability",
        "runtimeAdmission",
        "independentAcceptance",
        "nativeClosure",
        "release"
      ],
      "properties": {
        "sourceOwnerDecision": {
          "const": "STRUCTURED_ROOT_DECISION_BOUND; CANONICAL_PXD_ENTRY_PROPOSED"
        },
        "technicalPeer": {
          "const": "PENDING"
        },
        "canonicalApply": {
          "const": "NOT_PERFORMED"
        },
        "phaseStatus": {
          "const": "UNCHANGED"
        },
        "sourceCurrentness": {
          "const": "NOT_CLAIMED"
        },
        "qualityApplicability": {
          "const": "UNKNOWN_PENDING_REVIEW"
        },
        "runtimeAdmission": {
          "const": "NOT_ADMITTED"
        },
        "independentAcceptance": {
          "const": "NOT_CLAIMED"
        },
        "nativeClosure": {
          "const": "NOT_CLAIMED"
        },
        "release": {
          "const": "NOT_AUTHORIZED"
        }
      }
    },
    "predecessorV6": {
      "type": "object",
      "additionalProperties": false,
      "required": [
        "ref",
        "sha256",
        "immutable"
      ],
      "properties": {
        "ref": {
          "const": "docs/implementation/observations/pdp0-semantic-audit-slices/AUD-SPEC-002-source-amendment-candidate.v6.json"
        },
        "sha256": {
          "type": "string",
          "pattern": "^[a-f0-9]{64}$"
        },
        "immutable": {
          "const": true
        }
      }
    }
  }
}
