{
  "schemaVersion": "media.pdp0.aud-spec-002-source-amendment-postimage.v7",
  "artifactKind": "NON_CANONICAL_SIX_SOURCE_POSTIMAGE_PROPOSAL",
  "sourceBindings": {
    "rootDecisionSha256": "384026c46cd5dbdcc092daa213a68e00e8502a5b38626a65600c26be2b4f05a1",
    "capabilitiesSha256": "b688138bbdb6687a6f72b8faebbcd3fd24b4b0fcaef45131be431ab09ea3eeac",
    "requirementsSha256": "5fcb6076223e75c4aa2680265f003713b1a9a9392411864cbdc09812e542a765",
    "crosswalkSha256": "6eb4d5d5d593ee46c1bbb24dfeb379d936ed429d429b3d30956f166ea08c1a20",
    "capabilityLeafReviewSha256": "dc50362cb65b82db9a11edcf69fa596faa7189b447433c6d0988992d1363f0ad",
    "campaignExtensionsSha256": "7963e356453b3ecdc41ddc93fa969e51f48d8a95133daf72f6256bb8ea2773f6",
    "applicationsChannelsSha256": "9d11c57c866b360d34fc428862ded142c95d22ba7dc4add7a383d8cc389dcdc5",
    "auditSha256": "7889439f0d94f3153381bed8826a822f0a91f45859ae561fd6269a74f4751af2",
    "decisionLogSha256": "42876764d478b5a50a96f015f07069660b567cfba777f578167216d7c54f93e2"
  },
  "versionPopulation": {
    "historicalBaseCount": 462,
    "currentExtensionCount": 1,
    "futureProposalCount": 6,
    "currentVersionCount": 463,
    "totalExtensionCount": 7,
    "totalSourceDefinitionCount": 469,
    "currentExtensionIds": [
      "media.recipe.specification.compile"
    ],
    "futureProposalIds": [
      "media.generate.video.preset.manage",
      "media.generate.video.shot-condition",
      "media.job.schedule.manage",
      "media.master.audio.creative-effect.apply",
      "media.project.scene.patch-merge",
      "media.quality.audio.content-similarity.assess"
    ]
  },
  "meaning": {
    "ordinaryCompileCase": "MEDIA-REQ-CAP-RECIPE-TEMPLATE-AC-15",
    "supportedMigrationCase": "MEDIA-REQ-CAP-RECIPE-TEMPLATE-AC-16",
    "unsupportedMigrationCase": "MEDIA-REQ-CAP-RECIPE-TEMPLATE-AC-17",
    "p1Boundary": "HISTORICAL_462_HANDOFF_RETAINED; no new P1 operation or runtime binding"
  },
  "applicability": {
    "channelSource": ".product-experience/pdp-0-product-truth/applications-channels.yaml#coordinatorDefinitionExtensionApplicability/records/@capabilityRef=media.recipe.specification.compile",
    "channel": "media.channel.cli",
    "surfaceIdentityCount": 54,
    "phaseCellCount": 216,
    "qualityDisposition": "UNKNOWN_PENDING_SEPARATE_SOURCE_BOUND_QUALITY_REVIEW",
    "qualityReviewRef": "docs/implementation/verification/pdp-38/p0-quality-current-source-review-pxd225.json",
    "futureProposalCount": 6
  },
  "postimageSha256": {
    "capabilitiesYaml": "fb5fa356c007dfe3617f0d8505247439dcfdea27d28016797ec927099fbc74d2",
    "requirementsYaml": "672ccce00c5ee762cbcd716d68dd474acad023199d87c9f99b6b528234912cb7",
    "crosswalkJson": "6f6eb6267083174de9716efcfd42d20357fb933696bafbea7444b28abcdef8a3",
    "capabilityLeafReviewYaml": "3b1326a1a07a62633a731ada9ea547f032aa765286ef47ec1e930e3e73664253",
    "campaignExtensionsYaml": "df94787015aea30fa148355cbb0a7c564c3acd007ea16b277f05c849534b64ed",
    "decisionLogMarkdown": "e1f5acd296785b8f820d6b3cdc1582842e6956831d3220d354e6c4ba1a2cc60d"
  },
  "exactTargets": [
    {
      "targetRef": ".product-experience/pdp-0-product-truth/capabilities.yaml",
      "preimageSha256": "b688138bbdb6687a6f72b8faebbcd3fd24b4b0fcaef45131be431ab09ea3eeac",
      "postimageSha256": "44eda57faf9d129a31bbe713e58dc6d6df17bc675e10a5b3821979f9b505cbe0"
    },
    {
      "targetRef": ".product-experience/pdp-0-product-truth/requirements.yaml",
      "preimageSha256": "5fcb6076223e75c4aa2680265f003713b1a9a9392411864cbdc09812e542a765",
      "postimageSha256": "672ccce00c5ee762cbcd716d68dd474acad023199d87c9f99b6b528234912cb7"
    },
    {
      "targetRef": "docs/implementation/observations/pdp0-semantic-audit-slices/pdp0-501-disposition-crosswalk.json",
      "preimageSha256": "6eb4d5d5d593ee46c1bbb24dfeb379d936ed429d429b3d30956f166ea08c1a20",
      "postimageSha256": "56a9a74ff2d3e420bc60f4a305f4d0810176e06a0219fbb76646c83f53c7cab0"
    },
    {
      "targetRef": ".product-experience/pdp-0-product-truth/capability-leaf-review.yaml",
      "preimageSha256": "dc50362cb65b82db9a11edcf69fa596faa7189b447433c6d0988992d1363f0ad",
      "postimageSha256": "48f3ba485d6bc382d8b525464f3db382ab4cbf30fc60f0715be58cb86339e5dc"
    },
    {
      "targetRef": ".product-experience/pdp-0-product-truth/campaign-extensions.yaml",
      "preimageSha256": "7963e356453b3ecdc41ddc93fa969e51f48d8a95133daf72f6256bb8ea2773f6",
      "postimageSha256": "df94787015aea30fa148355cbb0a7c564c3acd007ea16b277f05c849534b64ed"
    },
    {
      "targetRef": ".product-experience/decision-log.md",
      "preimageSha256": "42876764d478b5a50a96f015f07069660b567cfba777f578167216d7c54f93e2",
      "postimageSha256": "e1f5acd296785b8f820d6b3cdc1582842e6956831d3220d354e6c4ba1a2cc60d"
    }
  ],
  "preservation": {
    "historicalOwnerRows": "462_BYTE_PRESERVED_IN_ORDER",
    "historicalTrustRows": "462_BYTE_PRESERVED_IN_ORDER",
    "currentExtensionRows": "SEPARATE_TYPED_OWNER_AND_TRUST_RECORDS; ONE",
    "futureExtensionIds": 6,
    "surfaceIdentityCount": 54,
    "phaseCellCount": 216
  },
  "authorityBoundary": {
    "sourceOwnerDecision": "STRUCTURED_ROOT_DECISION_BOUND; CANONICAL_PXD_ENTRY_PROPOSED",
    "technicalPeer": "PENDING",
    "canonicalApply": "NOT_PERFORMED",
    "phaseStatus": "UNCHANGED",
    "sourceCurrentness": "NOT_CLAIMED",
    "qualityApplicability": "UNKNOWN_PENDING_REVIEW",
    "runtimeAdmission": "NOT_ADMITTED",
    "independentAcceptance": "NOT_CLAIMED",
    "nativeClosure": "NOT_CLAIMED",
    "release": "NOT_AUTHORIZED"
  },
  "predecessorV6": {
    "ref": "docs/implementation/observations/pdp0-semantic-audit-slices/AUD-SPEC-002-source-amendment-candidate.v6.json",
    "sha256": "c26465cab01b8a6cf3b5e06e4b9714011e9d6cf761162b47aed977e7f581e7f8",
    "immutable": true
  }
}
